{
  "version": 1,
  "hazards": [
    {"country": "EGY", "hazard": "FL", "scenario": "historical", "path": "data/hazards/hazard_FL_EGY_historical.tif"},
    {"country": "EGY", "hazard": "FL", "scenario": "rcp26", "path": "data/hazards/hazard_FL_EGY_rcp26.tif"},
    {"country": "EGY", "hazard": "FL", "scenario": "rcp85", "path": "data/hazards/hazard_FL_EGY_rcp85.tif"},
    {"country": "EGY", "hazard": "HW", "scenario": "historical", "path": "data/hazards/hazard_HW_EGY_historical.h5"},
    {"country": "EGY", "hazard": "HW", "scenario": "rcp45", "path": "data/hazards/hazard_HW_EGY_rcp45.h5"},
    {"country": "EGY", "hazard": "HW", "scenario": "rcp85", "path": "data/hazards/hazard_HW_EGY_rcp85.h5"},
    {"country": "THA", "hazard": "D", "scenario": "historical", "path": "data/hazards/hazard_D_THA_historical.h5"},
    {"country": "THA", "hazard": "D", "scenario": "rcp45", "path": "data/hazards/hazard_D_THA_rcp45.h5"},
    {"country": "THA", "hazard": "D", "scenario": "rcp85", "path": "data/hazards/hazard_D_THA_rcp85.h5"},
    {"country": "THA", "hazard": "FL", "scenario": "historical", "path": "data/hazards/hazard_FL_THA_historical.tif"},
    {"country": "THA", "hazard": "FL", "scenario": "rcp26", "path": "data/hazards/hazard_FL_THA_rcp26.tif"},
    {"country": "THA", "hazard": "FL", "scenario": "rcp85", "path": "data/hazards/hazard_FL_THA_rcp85.tif"},
    {"country": "THA", "hazard": "HW", "scenario": "historical", "path": "data/hazards/hazard_HW_THA_historical.h5"},
    {"country": "THA", "hazard": "HW", "scenario": "rcp45", "path": "data/hazards/hazard_HW_THA_rcp45.h5"},
    {"country": "THA", "hazard": "HW", "scenario": "rcp85", "path": "data/hazards/hazard_HW_THA_rcp85.h5"}
  ],
  "entities": [
    {"country": "EGY", "hazard": "FL", "exposure_type": "crops", "path": "data/entities/entity_TODAY_EGY_FL_crops.xlsx"},
    {"country": "EGY", "hazard": "FL", "exposure_type": "diarrhea_patients", "path": "data/entities/entity_TODAY_EGY_FL_diarrhea_patients.xlsx"},
    {"country": "EGY", "hazard": "FL", "exposure_type": "hotels", "path": "data/entities/entity_TODAY_EGY_FL_hotels.xlsx"},
    {"country": "EGY", "hazard": "FL", "exposure_type": "livestock", "path": "data/entities/entity_TODAY_EGY_FL_livestock.xlsx"},
    {"country": "EGY", "hazard": "FL", "exposure_type": "power_plants", "path": "data/entities/entity_TODAY_EGY_FL_power_plants.xlsx"},
    {"country": "EGY", "hazard": "FL", "exposure_type": "roads", "path": "data/entities/entity_TODAY_EGY_FL_roads.xlsx"},
    {"country": "EGY", "hazard": "FL", "exposure_type": "students", "path": "data/entities/entity_TODAY_EGY_FL_students.xlsx"},
    {"country": "EGY", "hazard": "HW", "exposure_type": "crops", "path": "data/entities/entity_TODAY_EGY_HW_crops.xlsx"},
    {"country": "EGY", "hazard": "HW", "exposure_type": "hospitalised_people", "path": "data/entities/entity_TODAY_EGY_HW_hospitalised_people.xlsx"},
    {"country": "EGY", "hazard": "HW", "exposure_type": "hotels", "path": "data/entities/entity_TODAY_EGY_HW_hotels.xlsx"},
    {"country": "EGY", "hazard": "HW", "exposure_type": "livestock", "path": "data/entities/entity_TODAY_EGY_HW_livestock.xlsx"},
    {"country": "EGY", "hazard": "HW", "exposure_type": "students", "path": "data/entities/entity_TODAY_EGY_HW_students.xlsx"},
    {"country": "THA", "hazard": "D", "exposure_type": "grass_crops", "path": "data/entities/entity_TODAY_THA_D_grass_crops.xlsx"},
    {"country": "THA", "hazard": "D", "exposure_type": "grass_crops_farmers", "path": "data/entities/entity_TODAY_THA_D_grass_crops_farmers.xlsx"},
    {"country": "THA", "hazard": "D", "exposure_type": "tree_crops", "path": "data/entities/entity_TODAY_THA_D_tree_crops.xlsx"},
    {"country": "THA", "hazard": "D", "exposure_type": "tree_crops_farmers", "path": "data/entities/entity_TODAY_THA_D_tree_crops_farmers.xlsx"},
    {"country": "THA", "hazard": "D", "exposure_type": "water_users", "path": "data/entities/entity_TODAY_THA_D_water_users.xlsx"},
    {"country": "THA", "hazard": "D", "exposure_type": "wet_markets", "path": "data/entities/entity_TODAY_THA_D_wet_markets.xlsx"},
    {"country": "THA", "hazard": "FL", "exposure_type": "buddhist_monks", "path": "data/entities/entity_TODAY_THA_FL_buddhist_monks.xlsx"},
    {"country": "THA", "hazard": "FL", "exposure_type": "diarrhea_patients", "path": "data/entities/entity_TODAY_THA_FL_diarrhea_patients.xlsx"},
    {"country": "THA", "hazard": "FL", "exposure_type": "grass_crops", "path": "data/entities/entity_TODAY_THA_FL_grass_crops.xlsx"},
    {"country": "THA", "hazard": "FL", "exposure_type": "grass_crops_farmers", "path": "data/entities/entity_TODAY_THA_FL_grass_crops_farmers.xlsx"},
    {"country": "THA", "hazard": "FL", "exposure_type": "roads", "path": "data/entities/entity_TODAY_THA_FL_roads.xlsx"},
    {"country": "THA", "hazard": "FL", "exposure_type": "students", "path": "data/entities/entity_TODAY_THA_FL_students.xlsx"},
    {"country": "THA", "hazard": "FL", "exposure_type": "tree_crops", "path": "data/entities/entity_TODAY_THA_FL_tree_crops.xlsx"},
    {"country": "THA", "hazard": "FL", "exposure_type": "tree_crops_farmers", "path": "data/entities/entity_TODAY_THA_FL_tree_crops_farmers.xlsx"},
    {"country": "THA", "hazard": "FL", "exposure_type": "wet_markets", "path": "data/entities/entity_TODAY_THA_FL_wet_markets.xlsx"},
    {"country": "THA", "hazard": "HW", "exposure_type": "buddhist_monks", "path": "data/entities/entity_TODAY_THA_HW_buddhist_monks.xlsx"},
    {"country": "THA", "hazard": "HW", "exposure_type": "students", "path": "data/entities/entity_TODAY_THA_HW_students.xlsx"}
  ],
  "measures": [
    {"path": "requirements/adaptation_measures.json", "scope": "all"}
  ]
}
